NAME|KEY|NUMBER|COVER|PAGES|PRINTED_PRICE|CURRENCY|RELEASE_DATE|SHORT_REVIEW|ISBN10|EDITION|VARIANT
Black Butler #1|1|1|/panini-manga-mx/black-butler/black-butler-01.jpg|192|109|MXN|2017-11-15|Sebastian Michaelis. Mayordomo, cocinero, guardaespaldas, jardinero y experto en etiqueta. Siempre hace que su joven jefe, Ciel Phantomhive, mantenga el prestigio y la integridad física. Nunca permite que algo quede fuera de lugar o que los sirvientes caigan en la holgazanería. ¿Pero qué misterio guarda este singular hombre, que observa una agilidad y fuerza inimaginables y a quien las balas no le afectan? ¡Un personaje que no debe estar fuera de la mente fantástica de los asiduos lectores de mangas, y a quien podrás conocer en este primer tomo de Black butler!|978-6075287089|1|FALSE
Black Butler #2|2|2|/panini-manga-mx/black-butler/black-butler-02.jpg|200|109|MXN|2017-12-20|Un horrendo crimen donde se mezclan la mutilación, la magia negra y los cultos satánicos. Una cruel subasta y un baile aristocrático. Un disfraz indignante y una atracción irresistible. El vampiro demonio que informa a cambio de hacerlo reír. Y un giro insólito que revela una cruda verdad. Son algunas de las vicisitudes que tendrán que sortear el mayordomo Sebastian Michaelis y su amo Ciel Phantomhive para atrapar al criminal más sangriento de Londres.|978-6075287195|1|FALSE
Black Butler #3|3|3|/panini-manga-mx/black-butler/black-butler-03.jpg|192|109|MXN|2018-01-17|Habiendo descubierto la verdadera identidad de Jack el destripador, Sebastian y Ciel deberán enfrentarse a un cruel shinigami y a una despiadada asesina. Sin armas para defenderse, tendrán que eludir una potente pistola y una letal sierra eléctrica. ¿Serán suficientes las habilidades de Sebastian para vencerlos? ¿Cómo podrá derrotarlos, y al mismo tiempo defender la integridad del frágil conde Ciel?|978-6075288642|1|FALSE
Black Butler #4|4|4|/panini-manga-mx/black-butler/black-butler-04.jpg|194|109|MXN|2018-02-21|El Londres victoriano amanece con una nueva amenaza: varios ingleses que han radicado en la India aparecen atados y colgados de los pies. Scotland Yard de inmediato llama al hombre que puede descubrir quién está detrás de estos atentados: Ciel Phantomhive, quien se embarcará en una nueva aventura acompañado de su fiel y diestro mayordomo Sebastian Michaelis. Juntos conocerán a un príncipe hindú, a un avaricioso lord inglés y a otro mayordomo que parece aun más poderoso que Sebastian.|978-6075289137|1|FALSE
Black Butler #5|5|5|/panini-manga-mx/black-butler/black-butler-05.jpg|178|109|MXN|2018-03-18|Para liberar a una mujer hindú secuestrada por Lord West, el conde Ciel Phantomhive tendrá que ganarle en la competencia de curry y obtener así el codiciado sello real. Pero no será una empresa fácil: Sebastian, el mayordomo diabólico, deberá enfrentarse a los mejores chefs de curry de Inglaterra y, especialmente, al imbatible Agni -mayordomo del príncipe Soma-, cuya mano parece dirigida por los mismos dioses. Sebastian tendrá no solo que igualar la exquisitez del curry de Agni, ¡sino, además, sobrepasarlo!|978-6075289663|1|FALSE
Black Butler #6|6|6|/panini-manga-mx/black-butler/black-butler-06.jpg|178|109|MXN|2018-04-18|Varios niños comienzan a desaparecer a lo largo de toda Inglaterra. La policía no encuentra rastros de ellos ni tampoco sus cadáveres. El único indicio es la presencia de un circo itinerante en los lugares donde los niños se han extraviado. Preocupada por esas dolorosas ausencias, la reina Victoria convoca a Ciel Phantomhive para que haga una investigación exhaustiva y descubra el paradero de los pequeños. Así que el conde y su fiel mayordomo Sebastian se adentran en los terrenos del Noah´s Ark Circus, donde se topan con personajes extravagantes y siniestros cuyo pasado será la clave para hallar a los niños.|978-6075480107|1|FALSE
Black Butler #7|7|7|/panini-manga-mx/black-butler/black-butler-07.jpg|176|109|MXN|2018-05-23|Ciel y Sebastian continúan en su misión de dar con el paradero de los niños desaparecidos por toda Inglaterra. Cuando descubren dónde se encuentran, no pueden evitar horrorizarse ante el cruento espectáculo que tienen ante sus ojos. Una macabra función que involucra a varios niños desamparados, ahora convertidos en artistas de circo; a un asilo infantil que es cuna de futuros asesinos; y a un noble inglés que forma parte del oscuro pasado de Ciel Phantomhive.|978-6075481524|1|FALSE
Black Butler #8|8|8|/panini-manga-mx/black-butler/black-butler-08.jpg|178|109|MXN|2018-06-20|Por la noche, son cuatro soldados con habilidades para vencer a los más grandes, disparar varios rifles a la vez, lanzar pesadas columnas, manipular armas mortales, asesinar con sus propias manos a sicarios profesionales... Por la mañana, visten su uniforme y sirven a un joven amo de rostro inocente y adorable. Mientras los miembros del Noah´s Ark Circus atacan la mansión Phantomhive, Ciel da a Sebastian una orden cruel e irreversible que abrirá en el corazón del pequeño conde una herida difícil de cicatrizar. |978-6075481906|1|FALSE
Black Butler #9|9|9|/panini-manga-mx/black-butler/black-butler-09.jpg|176|109|MXN|2018-07-18|Los invitados de la mansión Phantomhive reciben con falsa alegría al distinguido huésped que viene desde Alemania con enigmáticos motivos que solo conoce la reina Victoria. Todo es fiesta y alegría, especialmente por un vino singular que anula todas las inhibiciones. Pero al llegar la madrugada, el escenario festivo se convertirá en una casa luctuosa: poco a poco empiezan a morir asesinados varios de los invitados... Y el más querido empleado del conde Ciel. ¡Ayuda a resolver el misterio que amenaza la mansión Phantomhive en el tomo 9 de Black butler!|978-6075482613|1|FALSE
Black Butler #10|10|10|/panini-manga-mx/black-butler/black-butler-10.jpg|178|109|MXN|2018-08-15|Los asesinatos ocurridos en el marco de una cena de honor en la mansión Phantomhive han permitido asomarse a ciertas realidades que estaban ocultas: el origen de los empleados del conde Ciel, el uso gastronómico de ciertas hierbas, la capacidad organizativa del señor Tanaka, el interior de la habitación de Sebastian, la importancia del olor de cada persona y la existencia del capellán de las tierras que pertenecen a los Phantomhive. Un poder deductivo nunca antes visto y la inusual colaboración de Bardroy, Finnian y Mey-Rin podrían ser las claves para revelar este misterio. ¡Sigue la pista para descubrir al asesino en las páginas de Black butler 10!|978-6075483306|1|FALSE
Black Butler #11|11|11|/panini-manga-mx/black-butler/black-butler-11.jpg|178|109|MXN|2018-09-19|Tras explicar al doctor Conan Doyle las claves del misterio de los asesinatos en la mansión Phantomhive, Sebastian le revela al conde Ciel la identidad del verdadero asesino. Luego de reclutar al pequeño rufián como nuevo lacayo, Ciel y Sebastian se embarcan en un lujoso crucero para infiltrarse entre los miembros de la Sociedad Aurora, un poderoso y siniestro grupo que asegura poseer el remedio al gran mal que aqueja a la humanidad: la muerte. Pero lo que parecía ser un viaje de descanso y una simple investigación, podría tornarse en un infierno sin salida en altamar. ¡Un nuevo y palpitante arco da inicio en el tomo 11 de Black Butler!|978-6075484044|1|FALSE
Black Butler #12|12|12|/panini-manga-mx/black-butler/black-butler-12.jpg|178|109|MXN|2018-10-17|Sobre las frías aguas del Atlántico surca el Campania con una macabra amenaza a bordo: los experimentos fallidos de la Sociedad Aurora, que cobran la forma de cadáveres ambulantes dispuestos a devorar a todo ser vivo. Solo existe una manera de acabar con ellos, pero los pocos tripulantes con vida no son capaces de hacerles frente. Ciel, Lizzy, Snake y Sebastian tendrán que hacer uso de recursos hasta ahora ocultos para salvar sus vidas. Pero hay amenazas igual de letales que también viajan en ese barco y que tomarán forma cuando todos crean que están a salvo. ¡Navega con el mayordomo más diabólico del mundo del manga en el tomo 12 de Black butler!|978-6075484228|1|FALSE
Black Butler #13|13|13|/panini-manga-mx/black-butler/black-butler-13.jpg|200|109|MXN|2015-11-21|No se sueltan a incontables cadáveres andantes por un crucero de lujo sin una intención malévola... y oculta. Ciel y Sebastian descubren el verdadero propósito de la feroz masacre que acontece en el barco Campania, pero ellos saben que es demasiado tarde: la revelación del gran secreto también incluye la manifestación del verdadero guardián de los cuerpos sin vida, un feroz guerrero que hará lo imposible para que el barco arribe a tierras norteamericanas. ¡Traspasa el delicado límite entre la vida y la muerte en el tomo 13 de Black butler!|000-0000000000|1|FALSE
Black Butler #14|14|14|/panini-manga-mx/black-butler/black-butler-14.jpg|200|109|MXN|2018-12-19|Con el crucero de lujo Campania a punto de hundirse, Sebastian tiene que salvar a Ciel y derrotar al mismo tiempo al traicionero Undertaker. Pero la amenaza no termina cuando logran salir a flote, ¡porque los cadáveres andantes no necesitan respirar para moverse en busca de almas vivientes! Si Sebastian y Ciel consiguen sortear esa terrible amenaza, dos graves peligros los aguardan: un lúgubre colegio que mantiene cautivos a sus estudiantes... y una arriesgada búsqueda de huevos de pascua. ¿Te atreverás a perderte el tomo 14 de Black butler?|978-6075485584|1|FALSE
Black Butler #15|15|15|/panini-manga-mx/black-butler/black-butler-15.jpg|178|109|MXN|2019-01-23|El hijo de un conde en paradero desconocido. Un prestigioso colegio que despierta sospechas. Cuatro dormitorios que rivalizan entre sí y cuatro siniestros prefectos. Un director omnipresente e invisible a la vez. Varios estudiantes ausentes. Un sistema de jerarquías indigno y deseable. Una ayuda eficaz que llega desde la lejana India. Y un pequeño conde que deberá penetrar en los confines de esta lúgubre escuela. ¡Adéntrate en la oscuridad de Black butler 15!|978-6075486635|1|FALSE
Black Butler #16|16|16|/panini-manga-mx/black-butler/black-butler-16.jpg|200|109|MXN|2019-02-20|Sin ninguna pista para hallar a los estudiantes desaparecidos del Colegio Weston, la única manera que tienen Ciel y Sebastian para encontrarlos es ver en persona al elusivo director. Pero éste enigmático personaje solo visitará el colegio en la Fiesta del Té de Medianoche. Y para participar en ella, Ciel deberá convertirse en el mejor jugador del torneo anual de cricket de la escuela. ¿Lo tiene fácil? ¡El mayordomo más diabólico del mundo del manga espera por ti en las páginas del tomo 16 de Black butler!|000-0000000000|1|FALSE
Black Butler #17|17|17|/panini-manga-mx/black-butler/black-butler-17.jpg|178|109|MXN|2019-03-20|¡El tradicional torneo de críquet del Colegio Weston está reñidísimo! El equipo de Ciel no tiene ninguna posibilidad de ganar ante los otros aguerridos dormitorios. Sin embargo, el joven Phantomhive y su fiel mayordomo han preparado varias estrategias que los acercarán al ansiado triunfo y, con él, a la posibilidad de reunirse con el escurridizo director del colegio. ¿Lograrán su cometido, antes de que otros estudiantes desaparezcan? ¡Lee el tomo 17 de Black butler y participa en el torneo de críquet más diábólico del mundo del manga!|000-0000000000|1|FALSE
Black Butler #18|18|18|/panini-manga-mx/black-butler/black-butler-18.jpg|200|109|MXN|2019-04-17|¡El tradicional torneo de críquet del Colegio Weston está reñidísimo! El equipo de Ciel no tiene ninguna posibilidad de ganar ante los otros aguerridos dormitorios. Sin embargo, el joven Phantomhive y su fiel mayordomo han preparado varias estrategias que los acercarán al ansiado triunfo y, con él, a la posibilidad de reunirse con el escurridizo director del colegio. ¿Lograrán su cometido, antes de que otros estudiantes desaparezcan? ¡Lee el tomo 17 de Black butler y participa en el torneo de críquet más diábólico del mundo del manga!|978-6075488738|1|FALSE
Black Butler #19|19|19|/panini-manga-mx/black-butler/black-butler-19.jpg|178|109|MXN|2019-05-22|Para investigar las inexplicables muertes que aquejan el sur de Alemania, Ciel y sus sirvientes viajan a un lejano pueblo rodeado de un bosque, supuestamente vigilado por hombres lobo. Las amenazas que allí encontrarán serán peores a las que han padecido en todas sus aventuras.|978-6075489407|1|FALSE
Black Butler #20|20|20|/panini-manga-mx/black-butler/black-butler-20.jpg|178|109|MXN|2019-06-19|"Mientras Ciel se recupera de los terribles efectos de las emanaciones del Bosque de Lobos, Sebastian desciende a las entrañas del castillo de la Bruja Esmeralda para investigar la verdad detrás del misterioso pueblo alemán. En tanto, una misiva de la reina le da al mayordomo la clave para descubrir la gran farsa en la que están involucrados. Para escapar de ese sitio, deberán enfrentar la furia de los ""hombres lobo"" y un arma letal que podría dejarlos al borde de la locura. "|978-6076340042|1|FALSE
Black Butler #21|21|21|/panini-manga-mx/black-butler/black-butler-21.jpg|200|109|MXN|2019-07-17|Con el imponente ejército alemán pisándoles los talones, Ciel y sus sirvientes tendrán que pelear como nunca lo han hecho para poder escapar del Bosque de los Hombres Lobo y poner a resguardo a la Bruja Esmeralda y su prodigiosa mente. Pero ni el mismo Sebastian está preparado para enfrentar una de las mayores amenazas metálicas del belicismo germano, así que deberá improvisar un plan de ataque si quiere salvar a su preciado amo y a sus compañeros. Acaso esta aventura será la más arriesgada de todas las que han vivido, pues incluye mortíferas armas que los pueden dejar en el camino.|978-6076341445|1|FALSE
Black Butler #22|22|22|/panini-manga-mx/black-butler/black-butler-22.jpg|200|109|MXN|2019-08-21|"La reina Victoria invita a la Bruja Esmeralda, Sieglinde Sullivan, a compartir la hora del té. Alarmados por los modales rústicos de la joven alemana, Ciel y Sebastian se dan a la casi imposible tarea de convertirla en una dama refinada, ¡en tan solo una semana! Pero lo que más preocupa a Ciel es que la reina desee aprovechar la mente superior de la Bruja Esmeralda para crear armas tanto o más letales que el gas venenoso ""Sulli"". ¿Entregará la joven Sullivan sus mortales secretos o rechazará la invitación de la soberana más poderosa de Europa?"|978-6076341629|1|FALSE
Black Butler #23|23|23|/panini-manga-mx/black-butler/black-butler-23.jpg|200|109|MXN|2019-09-18|"""¡Venga, venga a la reunión del sábado del Salón Sphere! Música, bebida, baile y comida, en un ambiente donde todas las clases sociales son permitidas. ¡Anímese con las piezas musicales, baile con la banda y asómbrese con la magia de nuestro adivino! Descubra qué estrella rige su destino y déjese guiar por ella. Pero si usted no vuelve a ser visto por nadie tras la reunión, descuide: siempre habrá alguien que hallará su cadáver en un estado bellamente conservado"". ¿Acaso planeas perderte el nuevo misterio de Ciel Phantomhive y su diabólico mayordomo? ¡Corre por el tomo 23 de Black Butler!"|978-6076343180|1|FALSE
Black Butler #24|24|24|/panini-manga-mx/black-butler/black-butler-24.jpg|178|109|MXN|2019-10-16|Mientras los Starlight 4 siguen acaparando la atención del público en Londres, Ciel y Sebastian comienzan a planear la manera de contrarrestar su carisma para que ya no atraigan tantas víctimas al Salón de Música Sphere. En medio de este conflicto, la sabia Bruja Esmeralda hace un descubrimiento que podría ser la clave para entender por qué últimamente aparecen tantos cadáveres desangrados. ¡Muévete al ritmo de la música infernal que el mayordomo diabólico tocará para ti en Black Butler 24!|978-6076343142|1|FALSE
Black Butler #25|25|25|/panini-manga-mx/black-butler/black-butler-25.jpg|176|109|MXN|2019-11-27|"Cuando el éxito de los Phamtom Five comienza a restarle asistentes a las funciones de los Cuatro ""S"", Blavat Sky toma una serie de medidas desesperadas que terminarán por revelar los oscuros planes de las transfusiones de sangre. Mientras tanto, Lord Soma da la bienvenida a un ""amigo"", cuyas intenciones teñirán de rojo sangre la residencia citadina del conde Ciel Phantomhive. Contempla los oscuros días que se avecinan para todos los que rodean al pequeño conde en las páginas de Black Butler 25."|978-6076343920|1|FALSE
Black Butler #26|26|26|/panini-manga-mx/black-butler/black-butler-26.jpg|168|109|MXN|2019-12-18|Un despiadado asesino irrumpe en la residencia citadina de Ciel Phantomhive y le arrebata la vida a un hombre fiel y dedicado. Conmocionado por esta terrible muerte, Ciel y Sebastian llegan a la mansión del campo solo para encontrarse con una sombra pretérita que amenaza con romper todo lo que el conde ha construido desde que empezó a trabajar al lado de su diabólico mayordomo. ¡Prepárate para ver cómo el pasado intenta devorar el presente de Ciel en las páginas de Black Butler 26!|978-6076344316|1|FALSE
Black Butler #27|27|27|/panini-manga-mx/black-butler/black-butler-27.jpg|168|109|MXN|2020-01-22|El 14 de diciembre de 1885 todos en la mansión Phantomhive preparan una fiesta para los hijos gemelos del conde, aunque esa noche nadie verá alegría alguna, pues todo el festejo será empañado por una masacre y por el secuestro de los dos pequeños. Sometidos a las más viles vejaciones, su salvación dependerá de un poder maligno cuyos contratos no son justos ni equitativos. La era más oscura de Black Butler acaba de empezar en el tomo 27 de esta siniestra historia. |978-6076345467|1|FALSE
Black Butler #28|28|28|/panini-manga-mx/black-butler/black-butler-28.jpg|168|109|MXN|2020-07-17|"El tomo 28 de Black Butler llega cargado de revelaciones asombrosas: la espantosa forma en que el ""auténtico Ciel"" sobrevivió a la tumba, el papel del cínico shinigami Undertaker en todo este drama, el sentido de los eventos más trágicos que Ciel ha padecido y, sobre todo, el crudo reclamo de lady Elizabeth y el porqué de su prolongada ausencia. ¿Cuál será, en todo este conflicto, el destino final del joven que hasta ahora conocíamos como Ciel?"|978-6076347171|1|FALSE
Black Butler #29|29|29|/panini-manga-mx/black-butler/black-butler-29.jpg|178|109|MXN|2020-10-07|Perseguidos por la policía y ocultos en la guarida de opio de Lau, Ciel y sus sirvientes emprenden un plan de acción para debilitar la fuerza del imponente y astuto nuevo Conde Phantomhive, quien tiene pensado aprovechar el capital y los éxitos económicos de su hermano menor. Así es como se inicia una carrera, cuya meta principal es nada menos que la preciada sangre que otorga vida. ¡Súmate a la rivalidad fraternal en el tomo 29 de Black Butler!|978-6075680118|1|FALSE
Black Butler #30|30|30|/panini-manga-mx/black-butler/black-butler-30.jpg|178|109|MXN|2021-04-14|Disfrazada como doncella, Mei-Rin se infiltra en la mansión de un barón, pero frente a ella aparece una empleada con un abrumador talento guerrero. En medio de la batalla, Mei-Rin recuerda momentos importantes de su vida. Las personas y las pérdidas de una joven, herida por los colmillos de una bestia, mientras el fragante y dulce aroma de la sopa roja burbujeante se eleva, se eleva...|978-6075683126|1|FALSE
Black Butler #31|31|31|/panini-manga-mx/black-butler/black-butler-31.jpg|178|109|MXN|2022-03-02|"Bard se dirige al sanatorio para veteranos en el oeste en compañía de Lau. Allí, él conoce a la ""sanadora de las manos milagrosas"" dedicada a sus pacientes. Privados de sus vidas, los soldados deambulan junto a sus camas, mientras la linterna blanca se mece, se mece. El mayordomo más higiénico de este mundo desinfecta este manga solo para ti."|978-6075687230|1|FALSE
