NAME|KEY|NUMBER|COVER|PAGES|PRINTED_PRICE|CURRENCY|RELEASE_DATE|SHORT_REVIEW|ISBN10|EDITION|VARIANT
Slam Dunk #1|1|1|/panini-manga-mx/slam-dunk/slam-dunk-01.jpg|200|129.0|MXN|2019-02-12|Comienza la historia de Hanamichi Sakuragi, un joven que fue rechazado por 50 chicas en sus días de secundaria y quien, tras ingresar en la preparatoria, se enamora de Haruko Akagi, una bella y jovial estudiante que le devuelve el brillo a su vida y le muestra las maravillas del deporte ráfaga; no obstante, está enamorada de Rukawa, el novato estrella del equipo de basquetbol, quien rápidamente se gana el odio de Hanamichi. Por otro lado, aunque este tiene talento natural para el deporte, se encuentra con dificultades que le hacen reconsiderar su ingreso en el equipo. ¿Será que solo se trataba de un medio para ganar el amor de Haruko. o en realidad hay un verdadero basquetbolista esperando aflorar en su interior?|978-6-075-48731-1|1|false
Slam Dunk #2|2|2|/panini-manga-mx/slam-dunk/slam-dunk-02.jpg|192|129.0|MXN|2019-04-17|Aota, el capitán del equipo de judo, considera que Hanamichi tiene un gran potencial para las artes marciales, así que decide reclutarlo, sin importar si debe usar medios sucios y violentos. Por si fuera poco, el camino del Hombre Básquetbol se complicará aun más porque no es capaz de dominar el tiro más elemental; obstante, ¡Haruko está dispuesta a ayudarlo en su camino hacia la cima del deporte ráfaga!|978-6-075-48856-1|1|false
Slam Dunk #3|3|3|/panini-manga-mx/slam-dunk/slam-dunk-03.jpg|235|129.0|MXN|2019-06-19|Shohoku jugará un partido de práctica contra Ryonan, uno de los equipos más fuertes del estado, cuyo capitán es Uozumi, viejo rival de Akagi. Una vez en el juego, Sendoh, el as de Ryonan, demuestra sus grandes habilidades y Shohoku apenas resiste gracias al esfuerzo de Rukawa y Akagi; entonces, cuando el final del partido se acerca, ¡el entrenador Anzai decide meter a jugar a Sakuragi, el arma secreta del equipo, quien declaró que derrotará a Sendoh!|978-6-076-34023-3|1|false
Slam Dunk #4|4|4|/panini-manga-mx/slam-dunk/slam-dunk-04.jpg|240|129.0|MXN|2019-08-21|¡El prodigioso Sakuragi finalmente se une al juego! Y, aunque al principio es un desastre por culpa de los nervios, gradualmente muestra su sólido potencial y sorprende a propios y extraños. pero no será suficiente ante la tremenda habilidad de Sendoh, quien pone a Shohoku en graves dificultades. Tras el regreso de Akagi, Hanamichi cobrará nuevos bríos y hará lo impensable -¡incluso aliarse con Rukawa!- para reducir la breve diferencia de puntos durante los pocos minutos que restan del partido.|978-6-076-34192-6|1|false
Slam Dunk #5|5|5|/panini-manga-mx/slam-dunk/slam-dunk-05.jpg|242|129.0|MXN|2019-10-23|¡El Hombre Basquetbol al fin anota sus primeros puntos a pocos segundos de que finalice el partido contra Ryonan! Y el marcador final es inesperado. Posteriormente, seremos testigos de la llegada de Ryota Miyagi, otro buscapleitos que posee gran aptitud para el basquetbol. Aunque al principio tiene problemas con Hanamichi debido a un malentendido, pronto descubren que tienen mucho en común y deciden fortalecer el equipo de Shohoku. pero no se imaginan que un grave peligro se cierne sobre ellos.|978-6-076-34257-2|1|false
Slam Dunk #6|6|6|/panini-manga-mx/slam-dunk/slam-dunk-06.jpg|232|129.0|MXN|2019-12-25|El club de basquetbol se encuentra en grave peligro: un grupo de delincuentes dirigido por un tal Mitsui irrumpe en el gimnasio con intención de golpear a todos los integrantes; ante esta amenaza, y aun a riesgo de que el equipo sea severamente sancionado, Sakuragi y Rukawa deciden plantarles cara. La pelea se torna tan violenta que los amigos de Hanamichi se involucran y, poco después, Kogure se acerca a un maltrecho Mitsui para hacerlo entrar en razón. Al parecer ya se conocían.|978-6-076-34257-2|1|false
Slam Dunk #7|7|7|/panini-manga-mx/slam-dunk/slam-dunk-07.jpg|232|139.0|MXN|2020-02-19|Finalmente se revela el motivo de que Mitsui, antiguo as del basquetbol, decidiera abandonar el equipo. pero su respeto hacia el entrenador Anzai no cambió.|978-6-076-34622-8|1|false
Slam Dunk #8|8|8|/panini-manga-mx/slam-dunk/slam-dunk-08.jpg|232|139.0|MXN|2020-06-24|Tras una serie de victorias, Shohoku debe disputar un partido contra Shoyo, el segundo equipo más fuerte de Kanagawa, y para ello cuentan con la presencia de Hanamichi desde el inicio del encuentro. sin embargo, los enormes y hábiles adversarios ponen a Akagi y compañía en serias dificultades, y si bien comienzan a remontar en el segundo tiempo, el ingreso de Fujima, entrenador y as de Shoyo, complica la situación.|978-6-076-34755-3|1|false
Slam Dunk #9|9|9|/panini-manga-mx/slam-dunk/slam-dunk-09.jpg|232|139.0|MXN|2020-08-26|La ventaja de Shohoku se hace añicos tras el ingreso de Fujima, pues las excelentes jugadas y el liderazgo del as de Shoyo aumentan drásticamente el nivel de su equipo. Por si fuera poco, Mitsui se siente agotado y, tras cometer su cuarta falta, Sakuragi teme que lo expulsen. No obstante, la pasión de Akagi será determinante en esta situación desesperada. ¿Qué equipo ganará el derecho de enfrentarse a Kainan?|978-6-076-34866-6|1|false
Slam Dunk #10|10|10|/panini-manga-mx/slam-dunk/slam-dunk-10.jpg|232|139.0|MXN|2020-10-28|Hanamichi toma por sorpresa a Kainan gracias a sus tremendas habilidades deportivas, así que el capitán Maki decide enfrentarlo. sin embargo, el entrenador Takato usa un arma secreta para contraatacar. Poco después, Akagi sufre un severo accidente y se ve obligado a abandonar la cancha; Shohoku se encuentra en serias dificultades, pero aún cuenta con Sakuragi y Rukawa.|978-6-075-68059-0|1|false
Slam Dunk #11|11|11|/panini-manga-mx/slam-dunk/slam-dunk-11.jpg|248|139.0|MXN|2021-01-27|¡Rukawa despliega su poderío y consigue el empate! Y, por si fuera poco, Akagi regresa a la chancha; sin embargo, Maki y Jin reaccionan rápidamente y Kainan vuelve a tomar la delantera. Luego, a pocos minutos del fin del partido, Hanamichi enciende su espíritu de lucha, libra un duelo contra Maki y anota dos tiros libres. ¡Los últimos momentos serán cruciales!|978-6-075-68148-1|1|false
Slam Dunk #12|12|12|/panini-manga-mx/slam-dunk/slam-dunk-12.jpg|248|139.0|MXN|2021-03-24|El partido contra Kainan alcanza su clímax: ¡Shohoku está a punto de conseguir el empate! Y a pocos segundos del fin del encuentro, Sakuragi supera a Maki y anota su primer dunk válido en un juego oficial. ¡¿Qué equipo se llevará la victoria?!|978-6-075-68247-1|1|false
Slam Dunk #13|13|13|/panini-manga-mx/slam-dunk/slam-dunk-13.jpg|248|139.0|MXN|2021-05-26|Hanamichi continúa avanzando con su entrenamiento intensivo, pero se queda dormido y llega tarde al juego contra Takezato. Sin embargo, Shohoku se las arregla bastante bien debido a su superioridad. Poco después comienza el esperado duelo entre Ryonan y Kainan. ¡Sendoh y Maki, los jugadores estrella de la prefectura, medirán sus habilidades! Y aunque ambos equipos luchan con todo, el marcador se mantiene muy parejo. ¡¿Quién reclamará la victoria?!|978-6-075-68404-8|1|false
Slam Dunk #14|14|14|/panini-manga-mx/slam-dunk/slam-dunk-14.jpg|248|139.0|MXN|2021-07-28|¡Es hora de decidir quién asistirá al Campeonato Nacional! El partido comienza muy igualado gracias la tremenda fuerza y las nuevas técnicas de Sakuragi, pero Sendoh y Fukuda hacen un digno papel como la vanguardia de Ryonan. Por su parte, Akagi libra un duelo de gigantes con Uozumi; sin embargo, poco a poco Shohoku se queda atrás en el marcador y, para empeorar las cosas, Hanamichi sufre una humillación a manos de Fukuda y Akagi resulta afectado por la lesión de su tobillo.|978-6-075-68518-2|1|false
Slam Dunk #15|15|15|/panini-manga-mx/slam-dunk/slam-dunk-15.jpg|192|139.0|MXN|2021-09-22|La moral de Shohoku sufre un golpe severo a causa de la derrota de Hanamichi frente a Fukuda, pero, en el momento más inesperado, Rukawa comienza a jugar de manera impresionante e incluso al nivel de Sendoh: ¡su plan era conservar su energía para explotarla durante la segunda mitad del partido! Por otro lado, Uozumi es enviado a la banca tras cometer su cuarta falta y Shohoku gradualmente toma la delantera. ¡Quedan pocos minutos de juego! Pero el entrenador Taoka tiene un plan.|978-6-075-68657-8|1|false
Slam Dunk #16|16|16|/panini-manga-mx/slam-dunk/slam-dunk-16.jpg|248|139.0|MXN|2021-11-24|¡El partido por el pase al Campeonato Nacional está por terminar! Y aunque Shohoku tiene una clara ventaja, Sendoh y Uozumi hacen gala de su terrible tenacidad; además, gracias a la estrategia de Taoka para explotar sus puntos débiles, el equipo pierde terreno y comienza a desmoronarse. ¡A unos cuantos minutos del final, Ryonan está a un tiro de igualar el marcador! Sin embargo, el plan de Taoka no consideró un impredecible elemento clave: Hanamichi Sakuragi.|978-6-075-68765-0|1|false
Slam Dunk #17|17|17|/panini-manga-mx/slam-dunk/slam-dunk-17.jpg|248|149.0|MXN|2022-02-23|¡Shohoku consigue el pase para asistir al Campeonato Nacional! Pero muchas cosas sucederán antes de disputarlo: Rukawa discute con el entrenador Anzai su deseo de viajar a Estados Unidos para seguir mejorando como jugador; Akagi recibe una oferta de parte del entrenador de una prestigiosa universidad y, por su parte, Hanamichi disputa un uno a uno contra Rukawa y se percata de que aún debe mejorar mucho. ¡Por suerte, el entrenador Anzai tiene preparado un entrenamiento especial para él!|978-6-075-68958-6|1|false
Slam Dunk #18|18|18|/panini-manga-mx/slam-dunk/slam-dunk-18.jpg|224|149.0|MXN|2022-03-23|Hanamichi termina su entrenamiento de tiros y Haruko lo acompaña a conseguir un nuevo par de tenis. ¡Ahora está listo para unirse a Shohoku en su viaje para ganar el Campeonato Nacional! Sin embargo, el primer enemigo a vencer es Toyotama, un equipo sumamente agresivo y con un veloz estilo Run & Gun. Una vez iniciado el juego, Shohoku pronto se queda atrás en el marcador. ¡¿El sueño de ganar el campeonato se desvanecerá?!|978-6-076-36005-7|1|false
