NAME|KEY|NUMBER|COVER|PAGES|PRINTED_PRICE|CURRENCY|RELEASE_DATE|SHORT_REVIEW|ISBN10|EDITION|VARIANT
Tower of God #1|1|1|/panini-manga-mx/tower-of-god/tower-of-god-01.jpg|288|199.0|MXN|2022-01-26|"¿Cuál es tu mayor deseo? ¿Dinero y riquezas? ¿Orgullo y honor? ¿Autoridad y poder? ¿Venganza? ¿O quizás algo más trascendente? ""No importa cuál sea, lo encontrarás aquí."""|978-6-075-68906-7|1|false
Tower of God #2|2|2|/panini-manga-mx/tower-of-god/tower-of-god-02.jpg|272|199.0|MXN|2022-03-16|Superando todo tipo de pruebas para escalar la torre, ¡La torre que tiene todo lo que podrías desear! Ahora comenzará el juego de la corona.|978-6-075-68962-3|1|false
Tower of God #3|3|3|/panini-manga-mx/tower-of-god/tower-of-god-03.jpg|280|199.0|MXN|2022-04-06|La batalla por la corona continua, ¿Quién saldrá victorioso en este juego extra? Después del juego extra comenzará el test para posicionar a los regulares, y veremos una gloriosa batalla entre Androssi y Anak.|978-6-076-36031-6|1|false
Tower of God #4|4|4|/panini-manga-mx/tower-of-god/tower-of-god-04.jpg|264|199.0|MXN|2022-05-04|Las pruebas continúan en el tomo 4 de Tower of god, en está ocasión tendrán que atrapar a un Ranker, es decir, un individuo que logró llegar a la cima de la torre. Separados en dos equipos y no todos podrán pasar.|978-6-076-36075-0|1|false
Tower of God #5|5|5|/panini-manga-mx/tower-of-god/tower-of-god-05.jpg|288|199.0|MXN|2022-06-15|La batalla contra un Ranker no es juego fácil, y más cuando el ranker tiene tanto repudio a perder. Las cosas no se ven fáciles para Khun, y ahora será el turno del equipo de Baam para completar la prueba, ¿Tendrá lo necesario?|978-6-076-36172-6|1|false
Tower of God #6|6|6|/panini-manga-mx/tower-of-god/tower-of-god-06.jpg|288|199.0|MXN|2022-07-27|La prueba de las escondidas llega a su final, y no todo termina de la mejor forma. ¿Lograrán pasar todos al siguiente piso?|-|1|false
Tower of God #7|7|7|/panini-manga-mx/tower-of-god/tower-of-god-07.jpg|288|199.0|MXN|2022-08-17|¿Cuál es tu mayor deseo? ¿Dinero y riquezas? ¿Orgullo y honor? ¿Autoridad y poder? ¿Venganza? ¿O quizás algo más trascendente? No importa cuál sea, lo encontrarás aquí.|978-6-076-36326-3|1|false
